<?xml version="1.0" encoding="utf-8" ?>
<AdSettings xmlns="http://wpunifiedad.codeplex.com" xmlns:xsi="http://www.w3.org/2001/XMLSchema-instance" xsi:schemaLocation="http://wpunifiedad.codeplex.com UnifiedAd.xsd">
  <CountryDescriptors>
    <AdCountryDescriptor Country="US, GB, VN" InitialAdProvider="Smaato">
      <Probability Value="20" AdProvider="PubCenter" />
      <Probability Value="30" AdProvider="AdDuplex" />
      <Probability Value="30" AdProvider="Smaato" />
    </AdCountryDescriptor>
    <AdCountryDescriptor InitialAdProvider="Smaato">
      <Probability Value="20" AdProvider="PubCenter" />
      <Probability Value="30" AdProvider="AdDuplex" />
      <Probability Value="30" AdProvider="Smaato" />   
    </AdCountryDescriptor>
  </CountryDescriptors>
</AdSettings>